[
  {
    "event_id": "sample_consumption_food_20260616",
    "event_date": "2026-06-16",
    "event_type": "Essential",
    "category": "Food",
    "amount": 38.5,
    "currency": "AUD",
    "merchant": "sample://local-grocery",
    "payment_method": "sample_card",
    "planned": true,
    "recurring": false,
    "necessity_score": 92,
    "impulse_score": 5,
    "regret_score": 0,
    "evidence_link": "sample://consumption/receipt-food-20260616",
    "review_status": "Reviewed",
    "notes": "Synthetic public example. Replace with local reviewed receipt evidence under data/private/consumption."
  },
  {
    "event_id": "sample_consumption_subscription_20260616",
    "event_date": "2026-06-15",
    "event_type": "Subscription",
    "category": "Subscription",
    "amount": 89.0,
    "currency": "AUD",
    "merchant": "sample://software-subscription",
    "payment_method": "sample_card",
    "planned": true,
    "recurring": true,
    "necessity_score": 64,
    "impulse_score": 12,
    "regret_score": 18,
    "evidence_link": "sample://consumption/receipt-subscription-20260615",
    "review_status": "Reviewed",
    "notes": "Synthetic recurring-cost fixture for public schema checks."
  },
  {
    "event_id": "sample_consumption_impulse_20260616",
    "event_date": "2026-06-14",
    "event_type": "Impulse",
    "category": "Shopping",
    "amount": 420.0,
    "currency": "AUD",
    "merchant": "sample://electronics-store",
    "payment_method": "sample_card",
    "planned": false,
    "recurring": false,
    "necessity_score": 15,
    "impulse_score": 94,
    "regret_score": 78,
    "evidence_link": "sample://consumption/receipt-impulse-20260614",
    "review_status": "Reviewed",
    "notes": "Synthetic high-impulse event. Real screenshots, exports, or receipts must stay private."
  }
]
